{
  "protocol_version": 0,
  "schema_version": 1,
  "event_id": "fixture-hud-messages-1",
  "server_id": "slgo-local-7777",
  "instance_id": "instance-2026-08-18-1645",
  "round_id": "round-7",
  "sequence": 14,
  "type": "hud.messages",
  "sent_at": "2026-08-18T08:46:21Z",
  "payload": {
    "progress": {
      "message_id": "hud-1042",
      "key": "SLGO_Progress_Generator_Shutdown",
      "text": "你正在关闭发电机。",
      "tone": "default",
      "visible_remaining_ms": null,
      "countdown_remaining_ms": null,
      "progress": { "remaining_ms": 2765, "total_ms": 7000 }
    },
    "alert": {
      "message_id": "hud-1040",
      "key": "CSGO_Notice_Alert_Timeout",
      "text": "NTF 队暂停还剩 {time_remaining}",
      "tone": "info",
      "visible_remaining_ms": null,
      "countdown_remaining_ms": 58000
    },
    "hint_high": {
      "message_id": "hud-1041",
      "key": "SFUI_BuyMenu_YoureOutOfTime",
      "text": "你的购买时间已过",
      "tone": "warning",
      "visible_remaining_ms": 2400,
      "countdown_remaining_ms": null
    },
    "hint_low": null
  }
}
