{
  "protocol_version": 0,
  "schema_version": 1,
  "event_id": "fixture-shop-refunds-1",
  "server_id": "slgo-local-7777",
  "instance_id": "instance-2026-08-18-1645",
  "round_id": "round-7",
  "sequence": 16,
  "type": "shop.snapshot",
  "payload": {
    "balance": 1250,
    "next_round_min_money": 3600,
    "window_open": true,
    "has_refundable": true,
    "categories": [
      { "id": "equipment", "label": "护甲", "order": 1 },
      { "id": "rifles", "label": "步枪", "order": 4 },
      { "id": "grenades", "label": "道具", "order": 5 }
    ],
    "items": [
      { "item_id": "ArmorHeavy", "name": "重型护甲", "icon_url": null, "price": 1000, "quantity": null, "owned_quantity": 0, "owner_player_ids": [], "category_id": "equipment", "purchasable": true, "unavailable_reason": null },
      { "item_id": "GunE11SR", "name": "E-11 SR", "icon_url": null, "price": 3100, "quantity": null, "owned_quantity": 1, "owner_player_ids": ["76561198000000001"], "category_id": "rifles", "purchasable": false, "unavailable_reason": "你已经拥有 E-11 SR", "refundable": true },
      { "item_id": "GrenadeFlash", "name": "闪光弹", "icon_url": null, "price": 200, "quantity": 1, "owned_quantity": 1, "owner_player_ids": ["76561198000000001"], "category_id": "grenades", "purchasable": true, "unavailable_reason": null, "refundable": true }
    ]
  }
}
