{
  "protocol_version": 0,
  "schema_version": 1,
  "event_id": "fixture-scoreboard-1",
  "server_id": "slgo-local-7777",
  "instance_id": "instance-2026-08-18-1645",
  "round_id": "round-15",
  "sequence": 21,
  "type": "scoreboard.snapshot",
  "sent_at": "2026-08-18T08:52:10Z",
  "payload": {
    "mode_name": "竞技模式",
    "mode_icon": "competitive",
    "elapsed_ms": 1504000,
    "max_rounds": 24,
    "score_to_win": 13,
    "halftime_after_round": 12,
    "rounds": [
      { "round": 1, "winner_team_id": "team-a", "winner_role": "scp", "reason": "elimination" },
      { "round": 2, "winner_team_id": "team-b", "winner_role": "ntf", "reason": "generator_activated" },
      { "round": 3, "winner_team_id": "team-a", "winner_role": "scp", "reason": "generator_deactivated" },
      { "round": 4, "winner_team_id": "team-a", "winner_role": "scp", "reason": "time_expired" },
      { "round": 6, "winner_team_id": "team-b", "winner_role": "ntf", "reason": "elimination" },
      { "round": 7, "winner_team_id": "team-b", "winner_role": "ntf", "reason": "generator_activated" },
      { "round": 8, "winner_team_id": "team-a", "winner_role": "scp", "reason": "elimination" },
      { "round": 9, "winner_team_id": "team-a", "winner_role": "scp", "reason": "generator_deactivated" },
      { "round": 10, "winner_team_id": "team-b", "winner_role": "ntf", "reason": "elimination" },
      { "round": 11, "winner_team_id": "team-a", "winner_role": "scp", "reason": "elimination" },
      { "round": 12, "winner_team_id": "team-b", "winner_role": "ntf", "reason": "generator_activated" },
      { "round": 13, "winner_team_id": "team-a", "winner_role": "ntf", "reason": "generator_activated" },
      { "round": 14, "winner_team_id": "team-b", "winner_role": "scp", "reason": "elimination" }
    ],
    "loss_bonus": { "team-a": 0, "team-b": 1 },
    "players": [
      {
        "player_id": "76561198000000100",
        "ping_ms": 42,
        "is_bot": false,
        "ntf": { "rounds_played": 2, "kills": 3, "deaths": 1, "assists": 1, "damage": 312, "headshot_kills": 2, "mvps": 1, "utility_damage": 48, "enemies_flashed": 2 },
        "scp": { "rounds_played": 11, "kills": 9, "deaths": 6, "assists": 2, "damage": 1410, "headshot_kills": 0, "mvps": 2, "utility_damage": 0, "enemies_flashed": 0 }
      },
      {
        "player_id": "dummy-7",
        "ping_ms": null,
        "is_bot": true,
        "ntf": { "rounds_played": 0, "kills": 0, "deaths": 0, "assists": 0, "damage": 0, "headshot_kills": 0, "mvps": 0, "utility_damage": 0, "enemies_flashed": 0 },
        "scp": { "rounds_played": 13, "kills": 4, "deaths": 9, "assists": 1, "damage": 655, "headshot_kills": 0, "mvps": 0, "utility_damage": 0, "enemies_flashed": 0 }
      }
    ]
  }
}
