{
  "protocol_version": 0,
  "schema_version": 1,
  "event_id": "fixture-hud-killfeed-1",
  "server_id": "slgo-local-7777",
  "instance_id": "instance-2026-08-18-1645",
  "round_id": "round-7",
  "sequence": 16,
  "type": "hud.killfeed",
  "sent_at": "2026-08-18T08:46:24Z",
  "payload": {
    "entries": [
      {
        "entry_id": "kill-11",
        "suicide": false,
        "killer": { "player_id": "76561198000000200", "display_name": "Echo", "team": "scp" },
        "assister": null,
        "victim": { "player_id": "76561198000000101", "display_name": "Kilo", "team": "ntf" },
        "weapon": "scp939",
        "headshot": false,
        "viewer": null,
        "visible_remaining_ms": 1800
      },
      {
        "entry_id": "kill-12",
        "suicide": false,
        "killer": { "player_id": "76561198000000001", "display_name": "Nova", "team": "ntf" },
        "assister": { "player_id": "76561198000000102", "display_name": "Lima", "team": "ntf" },
        "victim": { "player_id": "76561198000000200", "display_name": "Echo", "team": "scp" },
        "weapon": "e11sr",
        "headshot": true,
        "viewer": "killer",
        "visible_remaining_ms": 7120
      },
      {
        "entry_id": "kill-13",
        "suicide": true,
        "killer": null,
        "assister": null,
        "victim": { "player_id": null, "display_name": "Dummy 1", "team": "scp" },
        "weapon": "other",
        "headshot": false,
        "viewer": null,
        "visible_remaining_ms": 4950
      },
      {
        "entry_id": "kill-14",
        "suicide": true,
        "killer": { "player_id": "76561198000000001", "display_name": "Nova", "team": "ntf" },
        "assister": null,
        "victim": { "player_id": "76561198000000001", "display_name": "Nova", "team": "ntf" },
        "weapon": "other",
        "headshot": false,
        "viewer": "victim",
        "visible_remaining_ms": 7400
      }
    ]
  }
}
