{
  "protocol_version": 0,
  "schema_version": 1,
  "event_id": "fixture-hud-spectating-1",
  "server_id": "slgo-local-7777",
  "instance_id": "instance-2026-08-18-1645",
  "round_id": "round-7",
  "sequence": 16,
  "type": "hud.spectating",
  "sent_at": "2026-08-18T08:46:22Z",
  "payload": {
    "target": {
      "player_id": "76561198000000002",
      "money": 800,
      "item_name": "COM-15",
      "ammo": { "clip": 12, "clip_max": 12, "reserve": 36, "reserve_icon": "bullet" },
      "round_kills": ["default"]
    }
  }
}
