{
  "protocol_version": 0,
  "schema_version": 1,
  "event_id": "fixture-hud-status-1",
  "server_id": "slgo-local-7777",
  "instance_id": "instance-2026-08-18-1645",
  "round_id": "round-7",
  "sequence": 15,
  "type": "hud.status",
  "sent_at": "2026-08-18T08:46:21Z",
  "payload": {
    "ammo": { "clip": 23, "clip_max": 30, "reserve": 90, "reserve_icon": "bullet" },
    "round_kills": ["default", "grenade", "default"]
  }
}
