{
  "protocol_version": 0,
  "schema_version": 1,
  "event_id": "fixture-shop-1",
  "server_id": "slgo-local-7777",
  "instance_id": "instance-2026-08-18-1645",
  "round_id": "round-7",
  "sequence": 13,
  "type": "shop.snapshot",
  "payload": {
    "balance": 4250,
    "next_round_min_money": 4400,
    "window_open": true,
    "categories": [
      { "id": "equipment", "label": "装备", "order": 1 },
      { "id": "pistols", "label": "手枪", "order": 2 }
    ],
    "items": [
      { "item_id": "armor", "name": "Reinforced Armor", "description": "Durability +13", "icon_url": null, "price": 650, "quantity": 1, "owned_quantity": 0, "owner_player_ids": ["76561198000000002"], "category_id": "equipment", "purchasable": true, "unavailable_reason": null },
      { "item_id": "smoke", "name": "Smoke Grenade", "icon_url": null, "price": 300, "quantity": 0, "owned_quantity": 2, "owner_player_ids": ["76561198000000001"], "category_id": "equipment", "purchasable": false, "unavailable_reason": "Inventory limit reached" }
    ]
  }
}
