{
  "protocol_version": 0,
  "schema_version": 1,
  "event_id": "fixture-team-menu-1",
  "server_id": "slgo-local-7777",
  "instance_id": "instance-2026-08-18-1645",
  "round_id": "round-7",
  "sequence": 17,
  "type": "team.menu",
  "sent_at": "2026-08-18T08:46:23Z",
  "payload": {
    "menu": { "session_id": "7", "forced": false }
  }
}
