{
  "protocol_version": 0,
  "schema_version": 1,
  "event_id": "fixture-shop-requests-1",
  "server_id": "slgo-local-7777",
  "instance_id": "instance-2026-08-18-1645",
  "round_id": "round-7",
  "sequence": 15,
  "type": "shop.snapshot",
  "payload": {
    "balance": 2400,
    "next_round_min_money": 3600,
    "window_open": true,
    "categories": [
      { "id": "scp-low", "label": "危险", "order": 2 },
      { "id": "scp-mid", "label": "高危", "order": 3 }
    ],
    "items": [
      { "item_id": "Scp049", "name": "SCP-049", "icon_url": null, "price": 800, "quantity": 1, "owned_quantity": 0, "owner_player_ids": [], "category_id": "scp-low", "purchasable": true, "unavailable_reason": null, "requestable": true, "requested": false },
      { "item_id": "Scp939", "name": "SCP-939", "icon_url": null, "price": 2900, "quantity": 1, "owned_quantity": 0, "owner_player_ids": [], "category_id": "scp-mid", "purchasable": false, "unavailable_reason": "余额不足", "requestable": true, "requested": true }
    ],
    "requests": [
      { "request_id": "17", "requester_player_id": "76561198000000007", "requester_name": "Nova", "item_id": "Scp173", "name": "SCP-173", "description": "移动速度极快", "icon_url": null, "category_id": "scp-mid", "price": 1950, "purchasable": true, "unavailable_reason": null },
      { "request_id": "21", "requester_player_id": "76561198000000008", "requester_name": "Rook", "item_id": "Scp096", "name": "SCP-096", "icon_url": null, "category_id": "scp-mid", "price": 4750, "purchasable": false, "unavailable_reason": "余额不足" }
    ]
  }
}
